brand,nama,harga,deskripsi_id,deskripsi_en,foto
Nike,Nike SB Dunk Low x Travis Scott "Cactus Jack",35000000,"Dibuat dengan material suede premium, panel kanvas bermotif paisley yang bisa dikelupas, serta aksen flannel tartan yang ikonik khas Travis Scott.","Crafted with premium suede materials, tear-away paisley canvas panels, and iconic flannel tartan accents signature to Travis Scott.",nike_travis.jpeg
Nike,Nike Air Jordan 1 x Dior,150000000,"Diproduksi langsung di Italia menggunakan kulit lembu asli (Calfskin) kualitas tertinggi dengan motif monogram Oblique khas Dior pada logo Swoosh.","Manufactured directly in Italy using the highest quality calfskin leather with Dior's signature Oblique monogram on the Swoosh logo.",nike_dior.jpeg
Nike,Nike Air Jordan 1 Low x Travis Scott "Reverse Mocha",23500000,"Menampilkan kombinasi premium nubuck berwarna cokelat mocha dengan lapisan kulit sail, dilengkapi logo Swoosh terbalik yang menjadi ciri khas kolaborasi ini.","Featuring a premium brown mocha nubuck base paired with sail leather overlays, completed with the signature oversized backward Swoosh logo.",nike_travis_mocha.jpeg
Adidas,Adidas Samba "Black",2200000,"Siluet klasik legendaris berbahan full-grain leather hitam dengan suede T-toe overlay, serta sol karet (gum sole) responsif untuk kenyamanan harian.","The legendary classic silhouette featuring black full-grain leather, suede T-toe overlay, and a responsive gum sole for daily comfort.",adidas_samba.jpeg
Adidas,Adidas Gazelle Indoor "Blue Bird",2500000,"Menghidupkan kembali estetika retro era 70-an dengan material nubuck biru terang yang mewah, tiga garis putih kontras, dan sol karet semi-transparan.","Reviving the iconic 70s retro terrace aesthetic featuring plush blue bird nubuck, stark white serrated stripes, and a translucent gum sole.",adidas_gazzele.jpeg
Adidas,Adidas Yeezy Boost 350 V2 "Zebra",5500000,"Rajutan Primeknit berpola zebra hitam-putih yang revolusioner dengan teks 'SPLY-350' terbalik merah, didukung oleh teknologi bantalan Boost yang sangat empuk.","A revolutionary black and white zebra-patterned Primeknit upper highlighted by red 'SPLY-350' text, sitting atop a full-length cushioned Boost sole.",adidas_zebra.jpg
